Caption,Date,FileURL,Filename,InstaURL,Title,Geocoded,Latitude,Longitude
"District No. 1 Schoolhouse, Bethlehem. Built in 1865. It has also been the town library and the site of special events hosted by the Episcopal Church. It was restored by the Old Bethlem (not a typo) Historical Society for use as a museum. #bethlehem #bethlehemct #oldbethlem #ct #Connecticut #cthistory #newengland #newenglandhistory #oldschool #oldschoolhouse #oneroomschool #schoolhouse #oneroomschoolhouse",2/8/16 13:14,https://scontent-lhr3-1.cdninstagram.com/v/t51.2885-15/e35/12543370_555106361321518_1396662965_n.jpg?_nc_ht=scontent-lhr3-1.cdninstagram.com&_nc_cat=110&oh=f41775ecee68fb936024fa84e71fa92b&oe=5E86B7BA,12543370_555106361321518_1396662965_n.jpg,instagram.com/p/BBhs5q3oeWA,"District No. 1, Bethlehem","[41.6032207, -73.087749]",41.60322,-73.08775
"Hill's Academy (sometimes also written Hill Academy or Hills Academy), Essex. Built in 1832. The school building is now home to the Essex Historical Society. Their website discusses something that's not often included in records of early Connecticut education: its cost. ""From its opening in 1832 until 1848, the school was run by trustees and they kept the fees modest: English, $3.25 per semester; for Chemistry, Philosophy and Astronomy, $3.75; for French, $4.25; for Latin, Greek and higher branches of Mathematics, $4.75. There were additional fees for classes in music, painting, and other foreign languages. By 1848, prices had only risen by 25 cents per course. In that same year, when the trustees decided to lease the school to Lucius Lyon, a condition of the lease was that the rates must remain the same throughout the ten-year lease period."" There's more at essexhistory.org. #essex #essexct #ct #Connecticut #cthistory #newengland #newenglandhistory #oldschool #oldschoolhouse #schoolhouse",2/1/16 13:51,https://scontent-lhr3-1.cdninstagram.com/v/t51.2885-15/e35/12627996_1560160914307802_179187294_n.jpg?_nc_ht=scontent-lhr3-1.cdninstagram.com&_nc_cat=102&oh=1b4e6e2f2d9adfff70b8990a065afc9e&oe=5E8509EA,12627996_1560160914307802_179187294_n.jpg,instagram.com/p/BBPvhmpIeZ_,"Hill's Academy, Essex","[41.3533657, -72.3933756]",41.35337,-72.39338
"Old Farm School, Bloomfield. Built in 1796. #bloomfield #bloomfieldct #ct #Connecticut #cthistory #newengland #newenglandhistory #oldschool #oldschoolhouse #schoolhouse",1/25/16 13:42,https://scontent-lhr3-1.cdninstagram.com/v/t51.2885-15/e35/12523599_983734401687424_1517928372_n.jpg?_nc_ht=scontent-lhr3-1.cdninstagram.com&_nc_cat=104&oh=6d5312430da846c52d49e5966d711e38&oe=5E792DC7,12523599_983734401687424_1517928372_n.jpg,instagram.com/p/BA9s7PUIefU,"Old Farm School, Bloomfield","[41.8237888, -72.70869809999999]",41.82379,-72.7087
"South District School House, Farmington. Built in 1829. This building was once owned by Theodate Pope, who built the home that is now Farmington's Hill-Stead Museum. She converted the school to a house and it was inhabited by a couple with 11 (!) children. To read more about them, go to historicbuildingsct.com/?p=20889.  In more recent times, this former schoolhouse was used as a law office. (How come all the lawyers I ever have to deal with work in boring office buildings?) #farmington #farmingtonct #ct #Connecticut #cthistory #newengland #newenglandhistory #oldschool #oldschoolhouse #oneroomschool #schoolhouse #oneroomschoolhouse ",1/22/16 14:26,https://scontent-lhr3-1.cdninstagram.com/v/t51.2885-15/e35/915700_1775726702646701_808566562_n.jpg?_nc_ht=scontent-lhr3-1.cdninstagram.com&_nc_cat=105&oh=93473ff3a9c91bb9672784d02da130df&oe=5E7FF410,915700_1775726702646701_808566562_n.jpg,instagram.com/p/BA2DiTloeVZ,"South District School House, Farmington",,41.738774,-72.804368
"Dr. Daniel Lathrop School, Norwich. Built in 1783. #norwich #norwichct #norwichtown #ct #Connecticut #cthistory #newengland #newenglandhistory #oldschool #oldschoolhouse #oneroomschool #schoolhouse #oneroomschoolhouse  ",1/18/16 23:42,https://scontent-lhr3-1.cdninstagram.com/v/t51.2885-15/e35/12555892_530729960441049_1642886063_n.jpg?_nc_ht=scontent-lhr3-1.cdninstagram.com&_nc_cat=109&oh=a65a0a93b09d54a6197368522ee23bfc&oe=5E74E8E8,12555892_530729960441049_1642886063_n.jpg,instagram.com/p/BAsv_59oed7,"Dr. Daniel Lathrop School, Norwich","[41.7750547, -72.6993399]",41.77505,-72.69934
The refurbished interior of the former District 5 Schoolhouse in Ledyard. (See previous post.) #ledyard #ledyardct #ct #Connecticut #cthistory #newengland #newenglandhistory #oldschool #oldschoolhouse #oneroomschool #schoolhouse #oneroomschoolhouse,1/11/16 15:36,https://scontent-lhr3-1.cdninstagram.com/v/t51.2885-15/e35/12558869_1494712424169790_563434478_n.jpg?_nc_ht=scontent-lhr3-1.cdninstagram.com&_nc_cat=110&oh=d880c4114b2a0fcd14fbc6c4fe90e739&oe=5E6CE75D,12558869_1494712424169790_563434478_n.jpg,instagram.com/p/BAZ23t_oeec,,,,
"District 5 Schoolhouse, Ledyard. Built c. 1850. Of Ledyard's fourteen original schoolhouses, ten are still standing in some form, mostly as private houses. Three were preserved as schoolhouses. One of these, I posted back in July. Another is the first schoolhouse I posted and the profile pic for this account. This one was restored in 2002 by local teacher Carol Ambrosh and her third grade students from Ledyard Center School. It could have gone differently; in the 1980s, town officials considered using the schoolhouse to house chickens for the Ledyard Fair. #ledyard #ledyardct #ct #Connecticut #cthistory #newengland #newenglandhistory #oldschool #oldschoolhouse #oneroomschool #schoolhouse #oneroomschoolhouse",1/11/16 15:34,https://scontent-lhr3-1.cdninstagram.com/v/t51.2885-15/e35/12519154_1703091693239208_1117042773_n.jpg?_nc_ht=scontent-lhr3-1.cdninstagram.com&_nc_cat=100&oh=deaad8b6368ba922e6b58e248c566e49&oe=5E7F6EAD,12519154_1703091693239208_1117042773_n.jpg,instagram.com/p/BAZ2oD1Ied3,"District 5 Schoolhouse, Ledyard",,41.447195,-72.018155
"Land's End School, Newtown. Built c. 1850. #newtown #newtownct #ct #Connecticut #cthistory #newengland #newenglandhistory #oldschool #oldschoolhouse #oneroomschool #schoolhouse #oneroomschoolhouse",1/4/16 13:35,https://scontent-lhr3-1.cdninstagram.com/v/t51.2885-15/e35/1389511_535444056622929_444502886_n.jpg?_nc_ht=scontent-lhr3-1.cdninstagram.com&_nc_cat=109&oh=4c7bd97193550a789f201a8153ddfe8a&oe=5E7050DE,1389511_535444056622929_444502886_n.jpg,instagram.com/p/BAHnYK4IeYz,"Land's End School, Newtown",,41.402936,-73.298979
"These are the 9 CT Schoolhouses with the most likes in 2015. Located in, L-R: Johnsonville, East Haddam; Kent; Falls Village; Berlin; Avon; Hebron; Cannondale, Wilton; Southbury; Madison. Thanks for following🙂 #2015bestnine #Connecticut #oldschool #oldschoolhouse #oneroomschool #schoolhouse  #oneroomschoolhouse",12/29/15 22:48,https://scontent-lhr3-1.cdninstagram.com/v/t51.2885-15/e35/12346090_1743999565821693_846805535_n.jpg?_nc_ht=scontent-lhr3-1.cdninstagram.com&_nc_cat=109&oh=3181ad6d316ecdf300273404dd214f99&oe=5E78B38B,12346090_1743999565821693_846805535_n.jpg,instagram.com/p/_5J57cIeTz,,,,
"Old West School, West Hartford. Built in 1878. It's now used by the West Hartford Art League. #westhartford #westhartfordct #weha #ct #Connecticut #cthistory #newengland #newenglandhistory #oldschool #oldschoolhouse #oneroomschool #schoolhouse #oneroomschool #oneroomschoolhouse",12/28/15 18:18,https://scontent-lhr3-1.cdninstagram.com/v/t51.2885-15/e35/12393966_1681594685389727_1145930637_n.jpg?_nc_ht=scontent-lhr3-1.cdninstagram.com&_nc_cat=111&oh=85663e64dd7c30e420d9807e0af8dee5&oe=5E865E58,12393966_1681594685389727_1145930637_n.jpg,instagram.com/p/_2GMsMIedD,"Old West School, West Hartford","[41.7328785, -72.72438629999999]",41.73288,-72.72439
A little bonus seasonal close-up of the North Canton Schoolhouse (see previous post.) #canton #cantonct #northcanton #ct #Connecticut #cthistory #newengland #newenglandhistory #oldschool #oldschoolhouse #oneroomschool #schoolhouse #oneroomschool #oneroomschoolhouse,12/22/15 20:01,https://scontent-lhr3-1.cdninstagram.com/v/t51.2885-15/e35/12362270_412369595627713_31968230_n.jpg?_nc_ht=scontent-lhr3-1.cdninstagram.com&_nc_cat=101&oh=7409b425f4b0237a5e5f60d60a92d9bd&oe=5E706683,12362270_412369595627713_31968230_n.jpg,instagram.com/p/_m1RHnIeWL,,,,
"North Canton Schoolhouse, Canton. Built in 1872. #canton #cantonct #northcanton #ct #Connecticut #cthistory #newengland #newenglandhistory #oldschool #oldschoolhouse #oneroomschool #schoolhouse #oneroomschool #oneroomschoolhouse",12/22/15 19:57,https://scontent-lhr3-1.cdninstagram.com/v/t51.2885-15/e35/12346250_1512153269078473_872730645_n.jpg?_nc_ht=scontent-lhr3-1.cdninstagram.com&_nc_cat=101&oh=6aaeb6d75b3584a37ed0f66dc7cdd7e6&oe=5E69140C,12346250_1512153269078473_872730645_n.jpg,instagram.com/p/_m00A4oeVL,"North Canton Schoolhouse, Canton","[41.8998759, -72.8922998]",41.89988,-72.8923
"Rock School, Colebrook. Built in 1799. It was named for the large boulder nearby. This is thought to be the only colonial-era CT schoolhouse that was never modernized with electricity, plumbing, or other such upgrades. It is now a museum run by the Colebrook Historical Society. (By the way, if you think this photo looks like the perfect snowy December scene we're missing out on this year, you should know it was taken in March!) #colebrook #colebrookct #ct #Connecticut #cthistory #newengland #newenglandhistory #oldschool #oldschoolhouse #oneroomschool #schoolhouse #oneroomschool",12/14/15 17:15,https://scontent-lhr3-1.cdninstagram.com/v/t51.2885-15/e35/12362103_1698445780376788_402906587_n.jpg?_nc_ht=scontent-lhr3-1.cdninstagram.com&_nc_cat=104&oh=6c134047d6fc80bd824ea789f694c5f8&oe=5E687C33,12362103_1698445780376788_402906587_n.jpg,instagram.com/p/_R79mVIeVT,"Rock School, Colebrook","[42.007594, -73.1117762]",42.00759,-73.11178
"East Village Schoolhouse (a.k.a. Barn Hill Schoolhouse), Monroe. Built in 1790. #monroe #monroect #ct #Connecticut #cthistory #newengland #newenglandhistory #oldschool #oldschoolhouse #oneroomschool #schoolhouse #oneroomschool #oneroomschoolhouse",12/9/15 21:20,https://scontent-lhr3-1.cdninstagram.com/v/t51.2885-15/e35/12357811_420007124862572_1124991762_n.jpg?_nc_ht=scontent-lhr3-1.cdninstagram.com&_nc_cat=108&oh=e92d7d902a73a522252e6787a68ff2ac&oe=5E706302,12357811_420007124862572_1124991762_n.jpg,instagram.com/p/_Ff-1ooeeo,"East Village Schoolhouse, Monroe","[41.3584295, -73.18650149999999]",41.35843,-73.1865
"Center School, Wolcott. Built in 1929 or 1930. #wolcott #wolcottct  #ct #Connecticut #cthistory #newengland #newenglandhistory #oldschool #oldschoolhouse #oneroomschool #schoolhouse #oneroomschool #oneroomschoolhouse",12/3/15 21:05,https://scontent-lhr3-1.cdninstagram.com/v/t51.2885-15/e35/12269764_1683055911962560_813791867_n.jpg?_nc_ht=scontent-lhr3-1.cdninstagram.com&_nc_cat=104&oh=71577c275acd81defd9ace786899a489&oe=5E79EF17,12269764_1683055911962560_813791867_n.jpg,instagram.com/p/-2Bd9nIeU5,"Center School, Wolcott","[41.6070419, -72.9795493]",41.60704,-72.97955
The Brick School in Warren (see previous post) has a little mini-me of an outbuilding right next door.  #warren #warrenct #ct #Connecticut #cthistory #newengland #newenglandhistory #oldschool #oldschoolhouse #oneroomschool #schoolhouse #oneroomschool #oneroomschoolhouse,11/24/15 23:26,https://scontent-lhr3-1.cdninstagram.com/v/t51.2885-15/e35/12269728_1657336601215860_1441053336_n.jpg?_nc_ht=scontent-lhr3-1.cdninstagram.com&_nc_cat=100&oh=f7ed54ca20fcba3b9677b8deeeaaf471&oe=5E65D583,12269728_1657336601215860_1441053336_n.jpg,instagram.com/p/-fGcdMIefl,,,,
"Brick School, Warren. Built in 1784. It's located on Brick School Road. The Warren Historical Society, which has owned the building since the 1960s, says it is the longest continually operated one-room schoolhouse in Connecticut. The last class to attend this school graduated in 1924. #warren #warrenct #ct #Connecticut #cthistory #newengland #newenglandhistory #oldschool #oldschoolhouse #oneroomschool #schoolhouse #oneroomschool #oneroomschoolhouse  #ig_ct #scenesofnewengland #scenesofct #ig_connecticut #connecticutgram #ig_newengland #ignewengland #igersnewengland #ctlove #ctvisit",11/24/15 23:22,https://scontent-lhr3-1.cdninstagram.com/v/t51.2885-15/e35/12071082_1668786656740454_1288172355_n.jpg?_nc_ht=scontent-lhr3-1.cdninstagram.com&_nc_cat=102&oh=512ef3eac98d9a546e79ca11e9d6ae71&oe=5E876DB0,12071082_1668786656740454_1288172355_n.jpg,instagram.com/p/-fGCz8oee6,"Brick School, Warren","[41.75886089999999, -73.3737682]",41.75886,-73.37377
"Downtown District School, Norwalk. Built in 1826. The schoolhouse is one of three historic buildings (plus an old graveyard) that make up the Mill Hill Complex, managed by the Norwalk Historical Society. See more here: http://www.thesizeofconnecticut.com/2012/04/mill-hill.html?m=1 #norwalk #norwalkct #millhill #ct #Connecticut #cthistory #newengland #newenglandhistory #oldschool #oldschoolhouse #oneroomschool #schoolhouse #oneroomschool #oneroomschoolhouse",11/23/15 19:47,https://scontent-lhr3-1.cdninstagram.com/v/t51.2885-15/e35/12292749_917259714976710_1520798454_n.jpg?_nc_ht=scontent-lhr3-1.cdninstagram.com&_nc_cat=106&oh=ec91c8105afa54d92e265bf0e74b46db&oe=5E8B3A95,12292749_917259714976710_1520798454_n.jpg,instagram.com/p/-cIpYzoeZ0,"Downtown District School, Norwalk","[41.11316130000001, -73.4065943]",41.11316,-73.40659
"Umpawaug School, Redding. Built c. 1789. #redding #reddingct #ct #Connecticut #cthistory #newengland #newenglandhistory #oldschool #oldschoolhouse #oneroomschool #schoolhouse #oneroomschool #oneroomschoolhouse",11/16/15 14:54,https://scontent-lhr3-1.cdninstagram.com/v/t51.2885-15/e35/11934773_1519869298334353_1998267260_n.jpg?_nc_ht=scontent-lhr3-1.cdninstagram.com&_nc_cat=101&oh=b8fa434b1f7f665820678eff9d894d07&oe=5E69EF9B,11934773_1519869298334353_1998267260_n.jpg,instagram.com/p/-JlkqHoedc,"Umpawaug School, Redding","[41.3057662, -73.40224830000001]",41.30577,-73.40225
"The Old Academy, Wethersfield. Built in 1804. It has served as a school, a female seminary, and the Wethersfield Town Hall and library. It now houses research materials of the town's Historical Society. #wethersfield #wethersfieldct #ct #Connecticut #cthistory #newengland #newenglandhistory #oldschool #oldschoolhouse #schoolhouse",11/10/15 15:40,https://scontent-lhr3-1.cdninstagram.com/v/t51.2885-15/e35/12230796_1622857254643258_1901336063_n.jpg?_nc_ht=scontent-lhr3-1.cdninstagram.com&_nc_cat=110&oh=7e8bdf1efed5e6750b9b1b3d6bc65baf&oe=5E7A9478,12230796_1622857254643258_1901336063_n.jpg,instagram.com/p/96N_raIeXF,"The Old Academy, Wethersfield","[41.7101206, -72.6537453]",41.71012,-72.65375
"South Center District School No. 2, Woodbury. Built in 1876. #woodbury #woodburyct #ct #Connecticut #cthistory #newengland #newenglandhistory #oldschool #oldschoolhouse #oneroomschool #schoolhouse #oneroomschool #oneroomschoolhouse",11/5/15 13:10,https://scontent-lhr3-1.cdninstagram.com/v/t51.2885-15/e35/11356577_751516694952275_910498984_n.jpg?_nc_ht=scontent-lhr3-1.cdninstagram.com&_nc_cat=111&oh=ae97c9211b4e6622317347b4926a7a6e&oe=5E65B217,11356577_751516694952275_910498984_n.jpg,instagram.com/p/9tE7FJIeXZ,"South Center District School No. 2, Woodbury","[41.8687772, -72.44779249999999]",41.86878,-72.44779
"High Street School, Wethersfield. Built in 1862. (See previous post.) #happyhalloween #wethersfield #wethersfieldct #ct #Connecticut #cthistory #newengland #newenglandhistory #oldschool #oldschoolhouse #schoolhouse",10/31/15 14:01,https://scontent-lhr3-1.cdninstagram.com/v/t51.2885-15/e35/12080545_556645381151560_2066972235_n.jpg?_nc_ht=scontent-lhr3-1.cdninstagram.com&_nc_cat=104&oh=ff3e0aa3ca5375820d29c2bb10aff5d5&oe=5E7DB4D8,12080545_556645381151560_2066972235_n.jpg,instagram.com/p/9gSwyNoecU,"High Street School, Wethersfield","[41.667769, -72.6035677]",41.66777,-72.60357
"High Street School, Wethersfield. Built in 1862. This school, like many historic schoolhouses in Connecticut, is now a private home. Often they're not immediately identifiable as former schools, and I would not have guessed this building's past had I not seen the plaque. (See next post.) #wethersfield #wethersfieldct #ct #Connecticut #cthistory #newengland #newenglandhistory #oldschool #oldschoolhouse #schoolhouse",10/31/15 14:00,https://scontent-lhr3-1.cdninstagram.com/v/t51.2885-15/e35/12106142_1631370890421240_379366018_n.jpg?_nc_ht=scontent-lhr3-1.cdninstagram.com&_nc_cat=100&oh=2308d5327d8ba2900e974f933f8e2fe7&oe=5E87F5FC,12106142_1631370890421240_379366018_n.jpg,instagram.com/p/9gSopDoeb_,"High Street School, Wethersfield","[41.667769, -72.6035677]",41.66777,-72.60357
"Haddam Neck Schoolhouse, East Hampton. Built in 1822.  It is now the parish house of the Haddam Neck Congregational Church. #easthampton #easthamptonct #haddamneck #haddamneckct #ct #Connecticut #cthistory #newengland #newenglandhistory #oldschool #oldschoolhouse #oneroomschool #schoolhouse #oneroomschool #oneroomschoolhouse",10/29/15 18:22,https://scontent-lhr3-1.cdninstagram.com/v/t51.2885-15/e35/12081207_543784572454327_916632671_n.jpg?_nc_ht=scontent-lhr3-1.cdninstagram.com&_nc_cat=107&oh=addffe8ae2d99b3ce6f9e95a07d92f1a&oe=5E7B9A06,12081207_543784572454327_916632671_n.jpg,instagram.com/p/9bnCi4oecP,"Haddam Neck Schoolhouse, East Hampton","[41.5196387, -72.5180038]",41.51964,-72.518
"Hadlyme North School, East Haddam. Built in 1794. There's a good history of the schoolhouse and the area at hadlymenorthschool.org. It includes such facts as what books were used in the school in 1846: – Spelling: Webster
– Reading: Testament, Natural Preceptor, Readers Manual Saunders Third Reader, Easy Lessons
– Grammar: Smith’s Grammar
– Geography: Olney’s, Mitchell’s, Smith’s
– Arithmetic: Daboll’s

#easthaddam #easthaddamct #hadlyme #hadlymect #hadlymenorth #ct #Connecticut #cthistory #newengland #newenglandhistory #oldschool #oldschoolhouse #oneroomschool #schoolhouse #oneroomschool #oneroomschoolhouse",10/26/15 12:08,https://scontent-lhr3-1.cdninstagram.com/v/t51.2885-15/e35/12071230_921946357859357_1730821975_n.jpg?_nc_ht=scontent-lhr3-1.cdninstagram.com&_nc_cat=105&oh=cfa865a4da3760d606d3832a72faa4d9&oe=5E7A8533,12071230_921946357859357_1730821975_n.jpg,instagram.com/p/9TNzproeS7,"Hadlyme North School, East Haddam","[41.4224138, -72.4010326]",41.42241,-72.40103
"Unused school building, Bristol. Built in 1936. There has been a school on this site since 1755. As far as I can tell this building is currently being used by the city for storage while they try to sell it. Sometimes I come across places like this while looking for one-room schoolhouses. I've posted a few on this account before. These schools are not cute or particularly old but they are historic, so I figure I might as well take a picture and include them. This one also looks very creepy to me, in a seasonally appropriate sort of way. 👻 #bristol #bristolct #ct #Connecticut #cthistory #oldschool #oldschoolhouse #schoolhouse",10/22/15 12:27,https://scontent-lhr3-1.cdninstagram.com/v/t51.2885-15/e35/12145138_703797506418729_1650679286_n.jpg?_nc_ht=scontent-lhr3-1.cdninstagram.com&_nc_cat=109&oh=bf9bd3bbd6b63c8f1e65d8b4f67178a1&oe=5E8B14A6,12145138_703797506418729_1650679286_n.jpg,instagram.com/p/9I8yjIoeb2,"Unused school building, Bristol","[41.6696161, -72.9450318]",41.66962,-72.94503
"Gilead Hill Schoolhouse, Hebron. Built in...? Dates I have seen for the construction of this schoolhouse include 1748, 1792, 1850-1890, and ""late 1700s or early 1800s."" #hebron #hebronct #ct #Connecticut #cthistory #newengland #newenglandhistory #oldschool #oldschoolhouse #oneroomschool #schoolhouse #oneroomschool #oneroomschoolhouse",10/19/15 12:42,https://scontent-lhr3-1.cdninstagram.com/v/t51.2885-15/e35/12093410_1040712569302998_57734284_n.jpg?_nc_ht=scontent-lhr3-1.cdninstagram.com&_nc_cat=106&oh=ebb5b6eb409c573825d7423efeda7bb9&oe=5E81AEB8,12093410_1040712569302998_57734284_n.jpg,instagram.com/p/9BQKM-IeTV,"Gilead Hill Schoolhouse, Hebron","[41.6766229, -72.4090348]",41.67662,-72.40903
"Burrows Hill Schoolhouse, Hebron. Built between 1725 and 1735. This is the oldest surviving schoolhouse in the town of Hebron and one of the oldest (possibly *the* oldest) in all of Connecticut. #hebron #hebronct #ct #Connecticut #cthistory #newengland #newenglandhistory #oldschool #oldschoolhouse #oneroomschool #schoolhouse #oneroomschool #oneroomschoolhouse  #ig_ct #scenesofnewengland #scenesofct #ig_connecticut #connecticutgram #ig_newengland #igersnewengland #ctlove",10/12/15 20:45,https://scontent-lhr3-1.cdninstagram.com/v/t51.2885-15/e35/11856583_749574071856079_1656261629_n.jpg?_nc_ht=scontent-lhr3-1.cdninstagram.com&_nc_cat=107&oh=37306c96b9a825e22423268b95e3c010&oe=5E82F4D7,11856583_749574071856079_1656261629_n.jpg,instagram.com/p/8wF0MIoefY,"Burrows Hill Schoolhouse, Hebron","[41.6356545, -72.39175039999999]",41.63565,-72.39175
"Southwest District School, Bloomfield. Built in 1858 (from local traprock.) #bloomfield #bloomfieldct #ct #Connecticut #cthistory #newengland #newenglandhistory #oldschool #oldschoolhouse #oneroomschool #schoolhouse #oneroomschool #oneroomschoolhouse",10/8/15 15:10,https://scontent-lhr3-1.cdninstagram.com/v/t51.2885-15/e35/12139860_927151690705388_1332471965_n.jpg?_nc_ht=scontent-lhr3-1.cdninstagram.com&_nc_cat=108&oh=80beb18f92c657bab6aa92685c10fe7f&oe=5E8B575C,12139860_927151690705388_1332471965_n.jpg,instagram.com/p/8lMYm1oeVE,"Southwest District School, Bloomfield","[41.82335560000001, -72.708367]",41.82336,-72.70837
"School for Colored Children, Colchester. Built in 1998. The District Schoolhouse for Colored Children, which stood near the town green in Colchester, was established in 1803. It was the earliest ""attempt in Connecticut to provide educational opportunities specifically for African American youth,"" according to the Connecticut Freedom Trail. (For more, see ctfreedomtrail.org.) The teachers were African American as well. (For more on the teachers and students, see this 1998 story from the Day: https://news.google.com/newspapers?nid=1915&dat=19980828&id=R5ZGAAAAIBAJ&sjid=dPgMAAAAIBAJ&pg=5708,5594279&hl=en.) The original schoolhouse can be seen in a sketch that John Warner Barber made for his 1836 ""Historical Collections of Connecticut."" (See Wikipedia's ""Colchester, Connecticut"" page.) The building pictured here is about half the size of the original schoolhouse. The interior, a replica of a 19th century classroom, was constructed by students and faculty of Colchester schools. The building itself was provided by a local purveyor of sheds and gazebos. It opened in conjunction with Colchester's 300th anniversary. The building, and a historic marker explaining its significance, is located on Route 85 near Bacon Academy. #colchester #colchesterct #ctfreedomtrail #blackhistory #ct #Connecticut #cthistory #newengland #newenglandhistory #oldschool #oldschoolhouse #oneroomschool #schoolhouse #oneroomschool #oneroomschoolhouse #ctvisit",10/6/15 16:14,https://scontent-lhr3-1.cdninstagram.com/v/t51.2885-15/e35/12144129_1631772733741128_211442293_n.jpg?_nc_ht=scontent-lhr3-1.cdninstagram.com&_nc_cat=100&oh=2e77be065d266cb407e03bc1970582dc&oe=5E692C62,12144129_1631772733741128_211442293_n.jpg,instagram.com/p/8gKEkIoeYF,"School for Colored Children, Colchester","[41.5742016, -72.33349489999999]",41.5742,-72.33349
"Scotland North District School, Simsbury. Built c. 1790. Originally located in what is now the town of Bloomfield and was then a part of Simsbury called Scotland. (Not to be confused with the town of Scotland in eastern Connecticut.) It was used as a school until 1933, then a single family home (!) until it the Simsbury Historical Society acquired and moved it to the center of Simsbury in 1970. The Historical Society says that in the late 1800s, about 15 children from ages 5-15 attended the school. #simsbury #simsburyct #ct #Connecticut #cthistory #newengland #newenglandhistory #oldschool #oldschoolhouse #oneroomschool #schoolhouse #oneroomschool #oneroomschoolhouse",9/30/15 12:35,https://scontent-lhr3-1.cdninstagram.com/v/t51.2885-15/e35/11191339_469409629932249_826228266_n.jpg?_nc_ht=scontent-lhr3-1.cdninstagram.com&_nc_cat=109&oh=f4cf306267a813f32ee97107d0e90fee&oe=5E8990E3,11191339_469409629932249_826228266_n.jpg,instagram.com/p/8QUPRiIeaY,"Scotland North District School, Simsbury","[41.8540094, -72.82791499999999]",41.85401,-72.82791
"Old Bristol High School, Bristol. Built in 1890 and expanded in 1910 or 1912. Now this Richardsonian Romanesque high school on a hill is the home of the Bristol Historical Society. #bristol #bristolct #ct #Connecticut #cthistory #newengland #newenglandhistory #oldschool #oldschoolhouse #schoolhouse",9/25/15 11:50,https://scontent-lhr3-1.cdninstagram.com/v/t51.2885-15/e35/10890797_1471599829816508_1570383939_n.jpg?_nc_ht=scontent-lhr3-1.cdninstagram.com&_nc_cat=108&oh=f5285cc625aee0e0a3e900f256d9551e&oe=5E779DB9,10890797_1471599829816508_1570383939_n.jpg,instagram.com/p/8DXGElIeXW,"Old Bristol High School, Bristol","[41.6612449, -72.9607174]",41.66124,-72.96072
