Caption,Date,FileURL,Filename,InstaURL,Title,Geocoded,Latitude,Longitude
"North Chippens Hill Schoolhouse, Bristol. Built in 1884. The schoolhouse was only used for its intended purpose for a short time before it became first a Sunday School, and then a church. The building housed congregations of several different denominations over the years. Today it is called the Church of Eternal Light and it's a ""Pagan Spiritualist church."" The steeple and bell tower are relatively new. The building is believed by some to be haunted. #bristol #bristolct #ct #Connecticut #cthistory #newengland #newenglandhistory #oldschool #oldschoolhouse #oneroomschool #schoolhouse #oneroomschool #oneroomschoolhouse",9/21/15 11:50,https://scontent-lhr3-1.cdninstagram.com/v/t51.2885-15/e35/11820606_1474616229512422_1806797928_n.jpg?_nc_ht=scontent-lhr3-1.cdninstagram.com&_nc_cat=110&oh=9108e89f7a6f7f1087ec3c8707830401&oe=5E74E26B,11820606_1474616229512422_1806797928_n.jpg,instagram.com/p/75D9oeoeT-,"North Chippens Hill Schoolhouse, Bristol","[41.7084704, -72.96672540000002]",41.70847,-72.96673
"Monroe Center School, Monroe. Built c. 1830. Now a thrift shop (the second schoolhouse-turned-thrift-shop I've encountered so far) run by the Monroe Congregational Church. #monroe #monroect #ct #Connecticut #cthistory #newengland #newenglandhistory #oldschool #oldschoolhouse #schoolhouse",9/17/15 12:42,https://scontent-lhr3-1.cdninstagram.com/v/t51.2885-15/e35/11906195_483073488537283_1866876129_n.jpg?_nc_ht=scontent-lhr3-1.cdninstagram.com&_nc_cat=107&oh=c3d34b8484603680d672cc1a2693b3ef&oe=5E6F9E78,11906195_483073488537283_1866876129_n.jpg,instagram.com/p/7u2sBwoeQp,"Monroe Center School, Monroe",,41.333388,-73.234214
"Schoolhouse #3, Avon. Built in 1830. The Avon Historical Society moved it from West Avon to this location on East Main Street in 1981, and now uses it as an office, storage space, and museum. #avon #avonct #ct #Connecticut #cthistory #newengland #newenglandhistory #oldschool #oldschoolhouse #oneroomschool #schoolhouse #oneroomschool #oneroomschoolhouse",9/11/15 22:22,https://scontent-lhr3-1.cdninstagram.com/v/t51.2885-15/e35/11821853_175614586105724_675421186_n.jpg?_nc_ht=scontent-lhr3-1.cdninstagram.com&_nc_cat=108&oh=ff8ded2cda43c1617dba379fa32ad61c&oe=5E81F242,11821853_175614586105724_675421186_n.jpg,instagram.com/p/7gcWOdIedG,"Schoolhouse #3, Avon","[41.7686441, -72.8599103]",41.76864,-72.85991
"Old Stone School, Farmington. Built in 1790. #farmington #farmingtonct #ct #Connecticut #cthistory #newengland #newenglandhistory #oldschool #oldschoolhouse #schoolhouse",9/8/15 11:12,https://scontent-lhr3-1.cdninstagram.com/v/t51.2885-15/e35/11254316_870128209723760_146215629_n.jpg?_nc_ht=scontent-lhr3-1.cdninstagram.com&_nc_cat=108&oh=1af26cab8d0b389fe53974bc4c49bde7&oe=5E84A42A,11254316_870128209723760_146215629_n.jpg,instagram.com/p/7XhPuXoecg,"Old Stone School, Farmington","[41.73479469999999, -72.87561320000002]",41.73479,-72.87561
"""Little Red"" Schoolhouse, Glastonbury. Built as a one-room school in 1889. A second room was added in 1900. It is now the East Glastonbury Public Library. (Glastonbury has another public library with an interesting origin - I posted it today on my other account, @johnnakaplan.) #glastonbury #eastglastonbury #glastonburyct #eastglastonburyct #library #ct #Connecticut #cthistory #newengland #newenglandhistory #oldschool #oldschoolhouse #oneroomschool #schoolhouse #oneroomschool #oneroomschoolhouse",8/31/15 20:26,https://scontent-lhr3-1.cdninstagram.com/v/t51.2885-15/e35/11887163_867278453327799_844685992_n.jpg?_nc_ht=scontent-lhr3-1.cdninstagram.com&_nc_cat=103&oh=12fca8017fe80642c9eaa399d4e11d0e&oe=5E6E57BD,11887163_867278453327799_844685992_n.jpg,instagram.com/p/7D6UPxIeah,"""Little Red"" Schoolhouse, Glastonbury","[41.6861794, -72.5450779]",41.68618,-72.54508
"Stony Creek School, Branford. Built c. 1890. This building (on School Street) is one of two former Stony Creek Schools. (See previous post for the other.) Now a commercial building, it's occupied by several businesses & organizations, including...a school:) #branford #branfordct #stonycreek #stonycreekct #ct #Connecticut #cthistory #newengland #newenglandhistory #oldschool #oldschoolhouse #schoolhouse",8/30/15 18:51,https://scontent-lhr3-1.cdninstagram.com/v/t51.2885-15/e35/11910056_1481840515468752_485023060_n.jpg?_nc_ht=scontent-lhr3-1.cdninstagram.com&_nc_cat=100&oh=febb4cda080cdcf4a589c25dd6d5dee6&oe=5E8886D8,11910056_1481840515468752_485023060_n.jpg,instagram.com/p/7BKmvqoeej,"Stony Creek School, Branford","[41.27481909999999, -72.8134048]",41.27482,-72.8134
"Stony Creek School, Branford. Built in 1865. It's now the home of the Branford Land Trust. This is one of two former Stony Creek Schools on School Street. #branford #branfordct #stonycreek #stonycreekct #ct #Connecticut #cthistory #newengland #newenglandhistory #oldschool #oldschoolhouse #oneroomschool #schoolhouse #oneroomschool #oneroomschoolhouse",8/30/15 18:44,https://scontent-lhr3-1.cdninstagram.com/v/t51.2885-15/e35/11327016_981322721910874_1590064752_n.jpg?_nc_ht=scontent-lhr3-1.cdninstagram.com&_nc_cat=110&oh=8d53166ef8a9dbca4664c1c525cc0c5a&oe=5E6ACB4E,11327016_981322721910874_1590064752_n.jpg,instagram.com/p/7BJ1OTIecx,"Stony Creek School, Branford","[41.27481909999999, -72.8134048]",41.27482,-72.8134
"The Academy, Orange. Built in 1878 as a high school, it was later used as the town hall, town courthouse, and Board of Education offices. It is now used by the Orange Historical Society as a museum and research center. #orange #orangect #ct #Connecticut #cthistory #newengland #newenglandhistory #oldschool #oldschoolhouse #schoolhouse",8/26/15 15:04,https://scontent-lhr3-1.cdninstagram.com/v/t51.2885-15/e35/11875276_1686490581573661_45956174_n.jpg?_nc_ht=scontent-lhr3-1.cdninstagram.com&_nc_cat=101&oh=1f2b9b085e8051f6a2b65b643534d8cc&oe=5E6D3553,11875276_1686490581573661_45956174_n.jpg,instagram.com/p/62deh-IecD,"The Academy, Orange","[41.278637, -73.0265277]",41.27864,-73.02653
"Northwest District School, Hartford. Built in 1870 as a two-room schoolhouse, enlarged multiple times in the 19th and early 20th centuries. The building that stands on Albany Avenue today is the 1885 version; later sections were moved, then demolished. The building is being repaired so the John E. Rogers African American Cultural Center can move into the space. For more, see the website of the Hartford African American Heritage Trail: http://hartfordheritagetrail.org/heritage-trail/school/northwest-district-school/  #hartford #hartfordct #upperalbany #hartfordhasit #hartfordshouldhaveit 
#ct #Connecticut #cthistory #newengland #newenglandhistory #oldschool #oldschoolhouse #schoolhouse",8/24/15 11:20,https://scontent-lhr3-1.cdninstagram.com/v/t51.2885-15/e35/11850101_1612091605729234_810416587_n.jpg?_nc_ht=scontent-lhr3-1.cdninstagram.com&_nc_cat=110&oh=6c851694ac794cf6fdf03e28df0c4ff5&oe=5E7421F1,11850101_1612091605729234_810416587_n.jpg,instagram.com/p/6w6TxBoeeT,"Northwest District School, Hartford","[41.799349, -72.752472]",41.79935,-72.75247
"Former district school, Union. Built in 1846. (Fun facts about Union: it was the last CT town to be settled east of the Connecticut River, and has the highest elevation in CT east of the river as well. It's CT's smallest town in terms of population, though it's relatively large in terms of square miles. It is mostly forest.) #union #unionct #ct #Connecticut #cthistory #newengland #newenglandhistory #oldschool #oldschoolhouse #oneroomschool #schoolhouse #oneroomschool #oneroomschoolhouse",8/20/15 11:31,https://scontent-lhr3-1.cdninstagram.com/v/t51.2885-15/e35/11256688_986307844765457_839930347_n.jpg?_nc_ht=scontent-lhr3-1.cdninstagram.com&_nc_cat=105&oh=d142760d869bcb0dd39303886ea83aea&oe=5E66A7F2,11256688_986307844765457_839930347_n.jpg,instagram.com/p/6moUrNIeYe,"Former district school, Union","[41.98751120000001, -72.1619582]",41.98751,-72.16196
"Ashford Academy, Ashford. Built c. 1825-1829. This is the only building on Ashford's town green. (Btw if you like Colonial-era burial grounds, continue past it up the hill and you'll find the lovely old Babcock Cemetery.) This schoolhouse was recommended to me by someone here on Instagram, and I thought I'd never seen it before. After I took this picture, though, I remembered I'd written a blog post including a photo of the Ashford Academy back in 2010. I simply have a terrible memory and forgot to tag that post with ""schoolhouse.""😀 #ashford #ashfordct #ct #Connecticut #cthistory #newengland #newenglandhistory #oldschool #oldschoolhouse #schoolhouse",8/14/15 12:07,https://scontent-lhr3-1.cdninstagram.com/v/t51.2885-15/e35/11378272_601712479969897_778046834_n.jpg?_nc_ht=scontent-lhr3-1.cdninstagram.com&_nc_cat=101&oh=199014d654bfc06b309baa057f664e24&oe=5E7C3A20,11378272_601712479969897_778046834_n.jpg,instagram.com/p/6XPq0ZoeRP,"Ashford Academy, Ashford","[41.8730164, -72.1229998]",41.87302,-72.123
"White Oak School, Southbury. Built c. 1840. This school is located on the same street as the school in my previous post. There's more on how both of them got their names here: http://www.thesizeofconnecticut.com/2013/08/southbury-2-for-1.html?m=0 #southbury #southburyct #ct #Connecticut #cthistory #newengland #newenglandhistory #oldschool #oldschoolhouse #schoolhouse",8/9/15 19:26,https://scontent-lhr3-1.cdninstagram.com/v/t51.2885-15/e35/11356863_1652712131609959_1298992310_n.jpg?_nc_ht=scontent-lhr3-1.cdninstagram.com&_nc_cat=107&oh=245a6d66e6e606d75304f1184304c80c&oe=5E873D0C,11356863_1652712131609959_1298992310_n.jpg,instagram.com/p/6LJ8FbIeTz,"White Oak School, Southbury","[41.4974976, -73.2681595]",41.4975,-73.26816
"Bullet Hill School, Southbury. It was built in 1762, according to the Southbury Historical Society, which calls it the oldest public building in the town. Others say it was built later; the National Register of Historic Places, for one, says 1790. It was also known as the Brick School. #southbury #southburyct #ct #Connecticut #cthistory #newengland #newenglandhistory #oldschool #oldschoolhouse #schoolhouse",8/7/15 13:23,https://scontent-lhr3-1.cdninstagram.com/v/t51.2885-15/e35/11849284_1028215983879052_1343951850_n.jpg?_nc_ht=scontent-lhr3-1.cdninstagram.com&_nc_cat=104&oh=3776c631337f8a8e5d3aef6f65c49f17&oe=5E6E6448,11849284_1028215983879052_1343951850_n.jpg,instagram.com/p/6FW2FyoeX3,"Bullet Hill School, Southbury","[41.4825483, -73.21356229999999]",41.48255,-73.21356
"Peter Parley Schoolhouse or West Lane School or Little Red Schoolhouse, Ridgefield. Built c. 1756. This school is not unusual in that it's located on a small island of land between busy roads. Supposedly, schools were built at crossroads like this so that no one could dispute the town's ownership of the land. There's more about the school's history here: 
http://www.thesizeofconnecticut.com/2014/01/peter-parley-schoolhouse.html?m=1 #ridgefield #ridgefieldct #ct #Connecticut #cthistory #newengland #newenglandhistory #oldschool #oldschoolhouse #oneroomschool #schoolhouse #oneroomschool #oneroomschoolhouse",8/5/15 14:01,https://scontent-lhr3-1.cdninstagram.com/v/t51.2885-15/e35/11311376_116567188688782_1992408770_n.jpg?_nc_ht=scontent-lhr3-1.cdninstagram.com&_nc_cat=110&oh=173724e6e036328a3620e856494ca119&oe=5E7AA767,11311376_116567188688782_1992408770_n.jpg,instagram.com/p/6ARiBKIeVa,"Peter Parley Schoolhouse, Ridgefield","[41.2601823, -73.51334539999999]",41.26018,-73.51335
"Former schoolhouse, current North Woodstock Library, Woodstock. Built in 1843. The library moved into this building in 1950. There are still some original school desks inside. (And don't worry, the leaves aren't changing yet - I took this pic last fall;) #woodstock #woodstockct #northwoodstock #northwoodstockct 
#ct #Connecticut #cthistory #newengland #newenglandhistory #oldschool #oldschoolhouse #oneroomschool #schoolhouse #oneroomschool #oneroomschoolhouse
#ct #Connecticut #cthistory #newengland #newenglandhistory #oldschool #oldschoolhouse #oneroomschool #schoolhouse #oneroomschool #oneroomschoolhouse",8/2/15 13:40,https://scontent-lhr3-1.cdninstagram.com/v/t51.2885-15/e35/11282784_816578731774092_132624996_n.jpg?_nc_ht=scontent-lhr3-1.cdninstagram.com&_nc_cat=100&oh=495998fea0c6f34e328cf15a7dd7a277&oe=5E87E583,11282784_816578731774092_132624996_n.jpg,instagram.com/p/54gwT8IeYL,"Former schoolhouse, current North Woodstock Library, Woodstock","[41.9954233, -71.9998526]",41.99542,-71.99985
"Moor's Charity School, Columbia. Built in 1755 (in what was then the town of Lebanon.) This building housed a Christian school founded by Reverend Eleazar Wheelock, who intended to prepare Native Americans to return to their tribes as missionaries. His school wasn't much of a success in this location, but in 1770 Wheelock moved to New Hampshire and the rest is Ivy history: the plaque on the front of the school reads: ""Proudly remembered for two hundred years by generations of Dartmouth men as seeding ground of Dartmouth College and faithful steward of Eleazar Wheelock's generous and crusading spirit."" #columbia #columbiact #dartmouthcollege #ct #Connecticut #cthistory #newengland #newenglandhistory #oldschool #oldschoolhouse #oneroomschool #schoolhouse #oneroomschool #oneroomschoolhouse",7/30/15 11:05,https://scontent-lhr3-1.cdninstagram.com/v/t51.2885-15/e35/11821949_1450557118587229_283994375_n.jpg?_nc_ht=scontent-lhr3-1.cdninstagram.com&_nc_cat=101&oh=854b63b652265efa921ab60bedb58bd2&oe=5E7D8F92,11821949_1450557118587229_283994375_n.jpg,instagram.com/p/5wgrq_oebq,"Moor's Charity School, Columbia","[41.7020432, -72.30119169999999]",41.70204,-72.30119
"Cannondale School, Wilton. Built in 1872. Now it is a restaurant, called the Schoolhouse at Cannondale, located at Cannon Crossing. More about Cannondale and Cannon Crossing's other historic buildings here: http://www.thesizeofconnecticut.com/2012/02/6-useful-well-maybe-not-facts-about.html?m=0 #wilton #wiltonct #cannondale #ct #Connecticut #cthistory #newengland #newenglandhistory #oldschool #oldschoolhouse #oneroomschool #schoolhouse #oneroomschool #oneroomschoolhouse  #ig_ct #scenesofnewengland #scenesofct #ig_connecticut #connecticutgram #ig_newengland #igersnewengland #ctlove #ctvisit #cannondalect #cannoncrossing",7/28/15 13:58,https://scontent-lhr3-1.cdninstagram.com/v/t51.2885-15/e35/11351871_912981058789854_1248812248_n.jpg?_nc_ht=scontent-lhr3-1.cdninstagram.com&_nc_cat=106&oh=75ea6f3d5eeee268f9a41f75d513e2db&oe=5E738EDC,11351871_912981058789854_1248812248_n.jpg,instagram.com/p/5rq6juoedt,"Cannondale School, Wilton","[41.2170467, -73.425862]",41.21705,-73.42586
"Sometimes the school is gone, but its memory is preserved. The Gates Hill School in Salem burned down, but this sign remains. #salem #salemct #ct #Connecticut #cthistory #newengland #newenglandhistory #oldschool #oldschoolhouse #oneroomschool #schoolhouse #oneroomschool #oneroomschoolhouse",7/27/15 20:16,https://scontent-lhr3-1.cdninstagram.com/v/t51.2885-15/e35/10518131_812307732199231_91492473_n.jpg?_nc_ht=scontent-lhr3-1.cdninstagram.com&_nc_cat=107&oh=72ba7568d9307cf502733bc7848028de&oe=5E6CBD24,10518131_812307732199231_91492473_n.jpg,instagram.com/p/5pxYljoeei,"Gates Hill School sign, Salem","[41.6032207, -73.087749]",41.60322,-73.08775
"Lee Academy, Madison. Built in 1821. #madison #madisonct 
#ct #Connecticut #cthistory #newengland #newenglandhistory #oldschool #oldschoolhouse #schoolhouse",7/25/15 17:49,https://scontent-lhr3-1.cdninstagram.com/v/t51.2885-15/e35/10950559_734774313299396_1815093356_n.jpg?_nc_ht=scontent-lhr3-1.cdninstagram.com&_nc_cat=108&oh=0c1a37d28794773d7e41dbdce6b1b115&oe=5E73A2A2,10950559_734774313299396_1815093356_n.jpg,instagram.com/p/5kW9hsoeQc,"Lee Academy, Madison","[41.2810436, -72.63127709999999]",41.28104,-72.63128
"Hockanum School, East Hartford. Built in 1870. #easthartford #easthartfordct #ct #Connecticut #cthistory #newengland #newenglandhistory #oldschool #oldschoolhouse #schoolhouse",7/22/15 19:10,https://scontent-lhr3-1.cdninstagram.com/v/t51.2885-15/e35/11202442_781542751967451_104745425_n.jpg?_nc_ht=scontent-lhr3-1.cdninstagram.com&_nc_cat=103&oh=4b566aec53ec99e7c050ed2fff19fa7c&oe=5E6B569C,11202442_781542751967451_104745425_n.jpg,instagram.com/p/5cxyQWIedD,"Hockanum School, East Hartford","[41.7366686, -72.6318462]",41.73667,-72.63185
"Gales Ferry School, Gales Ferry, Ledyard. Built in 1868. This was not the first school to stand at this location; an earlier one was built around 1750. #galesferry #galesferryct #ledyard #ledyardct #ct #Connecticut #cthistory #newengland #newenglandhistory #oldschool #oldschoolhouse #oneroomschool #schoolhouse #oneroomschool #oneroomschoolhouse",7/20/15 21:04,https://scontent-lhr3-1.cdninstagram.com/v/t51.2885-15/e35/11324332_407719802766464_1138394153_n.jpg?_nc_ht=scontent-lhr3-1.cdninstagram.com&_nc_cat=108&oh=11d2715f545f2eee862309d3d58d1f64&oe=5E7CA711,11324332_407719802766464_1138394153_n.jpg,instagram.com/p/5X1RUiIefO,"Gales Ferry School, Gales Ferry, Ledyard","[41.4522631, -72.06988919999999]",41.45226,-72.06989
"(West) Wallop School, Enfield. Built in 1800. I decided to put this one up today because I just saw this recent article about its history and summer open house days: http://www.courant.com/reminder-news/enfield-edition/rnw-en-enfield-wallop-school-0723-20150715-story.html #enfield #enfieldct #ct #Connecticut #cthistory #newengland #newenglandhistory #oldschool #oldschoolhouse #oneroomschool #schoolhouse #oneroomschool #oneroomschoolhouse",7/17/15 12:41,https://scontent-lhr3-1.cdninstagram.com/v/t51.2885-15/e35/10661044_930727790333398_2062855373_n.jpg?_nc_ht=scontent-lhr3-1.cdninstagram.com&_nc_cat=110&oh=42ff60a4f6678ee37b368c630db301e8&oe=5E6EFDA5,10661044_930727790333398_2062855373_n.jpg,instagram.com/p/5PNWyKIeRz,"(West) Wallop School, Enfield","[41.9557651, -72.5428956]",41.95577,-72.5429
"Beebe Hill School, Falls Village, Canaan. Built in 1918 to replace the 1843 original which was destroyed in a fire. #ct #Connecticut #cthistory #newengland #newenglandhistory #oldschool #oldschoolhouse #oneroomschool #schoolhouse #oneroomschool #oneroomschoolhouse #fallsvillage #fallsvillagect #canaan #canaanct",7/16/15 13:03,https://scontent-lhr3-1.cdninstagram.com/v/t51.2885-15/e35/11356391_1719806368247046_1613003917_n.jpg?_nc_ht=scontent-lhr3-1.cdninstagram.com&_nc_cat=106&oh=374ce073953220923afe4e16a6144167&oe=5E8CF01C,11356391_1719806368247046_1613003917_n.jpg,instagram.com/p/5MrEw1oeb3,"Beebe Hill School, Falls Village, Canaan","[41.9530827, -73.35961510000001]",41.95308,-73.35962
"Brick Academy, Torrington. Built in 1835. This is the oldest building in Torrington's Downtown Historic District. That sounded quite strange to me until I read that when Torrington was first settled, the area that is now downtown was uninhabited, but was ""economically important as a source of pine timber."" (Quote from lakeridgect.com.) #torrington #torringtonct #ct #Connecticut #cthistory #newengland #newenglandhistory #oldschool #oldschoolhouse #schoolhouse",7/15/15 17:56,https://scontent-lhr3-1.cdninstagram.com/v/t51.2885-15/e35/11419225_101278710221931_1905459248_n.jpg?_nc_ht=scontent-lhr3-1.cdninstagram.com&_nc_cat=103&oh=e8511d88c1380e2db52cb8bffa87808a&oe=5E6B742C,11419225_101278710221931_1905459248_n.jpg,instagram.com/p/5Kn1EQIeWE,"Brick Academy, Torrington","[41.8062777, -73.0995813]",41.80628,-73.09958
"Skiff Mountain School, Kent. Built ""definitely pre-1812, and probably...nearer to 1760"" according to the Kent Historical Society. (This one is going on my favorites list!) #kent #kentct #ct #Connecticut #cthistory #newengland #newenglandhistory #oldschool #oldschoolhouse #oneroomschool #schoolhouse #oneroomschool #oneroomschoolhouse  #ig_ct #scenesofnewengland #scenesofct #ig_connecticut #connecticutgram #ig_newengland #igersnewengland #ctlove",7/14/15 12:22,https://scontent-lhr3-1.cdninstagram.com/v/t51.2885-15/e35/11249438_840329862717787_714502242_n.jpg?_nc_ht=scontent-lhr3-1.cdninstagram.com&_nc_cat=107&oh=cb0a7931868002ee991fb24495744e3d&oe=5E6A9CC2,11249438_840329862717787_714502242_n.jpg,instagram.com/p/5Hct0VoeXO,"Skiff Mountain School, Kent","[41.7829619, -73.45590969999999]",41.78296,-73.45591
"Goshen Academy, Goshen. Built in 1824. It is also known as Eagle Hall, and now houses the Goshen Historical Society. #goshen #goshenct #ct #Connecticut #cthistory #newengland #newenglandhistory #oldschool #oldschoolhouse #schoolhouse",7/13/15 12:06,https://scontent-lhr3-1.cdninstagram.com/v/t51.2885-15/e35/11280209_443309472497777_650174611_n.jpg?_nc_ht=scontent-lhr3-1.cdninstagram.com&_nc_cat=105&oh=19be09f4de9186daca0304ca10124261&oe=5E80005E,11280209_443309472497777_650174611_n.jpg,instagram.com/p/5E2GuioeQT,"Goshen Academy, Goshen","[41.83461519999999, -73.22672759999999]",41.83462,-73.22673
"Brick School, Coventry. Built in 1825. #coventry #coventryct #ct #Connecticut #cthistory #newengland #newenglandhistory #oldschool #oldschoolhouse #oneroomschool #schoolhouse #oneroomschool #oneroomschoolhouse",7/10/15 17:21,https://scontent-lhr3-1.cdninstagram.com/v/t51.2885-15/e35/11313526_1447194858919362_1828804368_n.jpg?_nc_ht=scontent-lhr3-1.cdninstagram.com&_nc_cat=106&oh=21f4d62403c795d74c97185f272a4cc1&oe=5E721DB4,11313526_1447194858919362_1828804368_n.jpg,instagram.com/p/49r1qooeTf,"Brick School, Coventry","[41.8184159, -72.3433223]",41.81842,-72.34332
"Little Red Schoolhouse or Cow Hill Red Schoolhouse, Clinton. Built in 1800. Located on Cow Hill Road, once the site of a pasture, this school fell into disrepair like many old schoolhouses do. But it was renovated in 1918 to create a clubhouse for the Cow Hill Red Schoolhouse Association. The club apparently held ""festivals"" at the school on holidays. #clinton #clintonct #ct #Connecticut #cthistory #newengland #newenglandhistory #oldschool #oldschoolhouse #oneroomschool #schoolhouse #oneroomschool #oneroomschoolhouse",7/8/15 20:50,https://scontent-lhr3-1.cdninstagram.com/v/t51.2885-15/e35/1172178_441705622697786_84242376_n.jpg?_nc_ht=scontent-lhr3-1.cdninstagram.com&_nc_cat=102&oh=4f284c848623cfa17d30a15dae092348&oe=5E716441,1172178_441705622697786_84242376_n.jpg,instagram.com/p/446JJjoeXK,"Little Red Schoolhouse, Clinton","[41.3103769, -72.5453685]",41.31038,-72.54537
"Higganum West School House, Haddam. Built in 1858. I debated whether or not to post this because it's half covered by the leaves. But I think you can still sort of see how it looks. The plaque is on the front of the building, which has been converted into condos. (One seems to be for sale, if anyone's interested! The address is 5 Candlewood Hill Rd.) The plaque says Higganum West, but this was once called the Green School because it replaced an earlier school building that stood on the nearby Higganum Green. Confusingly, some websites call this the ""Old Green School"" and say it was built in the 1840s. Also confusingly, another school - the Higganum Union School - is also said to have replaced the original Green School. This contradictory information is all just fun for an Instagram picture, but if I were writing a newspaper article or book about old schools I think Haddam would be one town that would drive me nuts:). #higganum #higganumct #haddam #haddamct #ct #Connecticut #cthistory #newengland #newenglandhistory #oldschool #oldschoolhouse #schoolhouse",7/8/15 15:36,https://scontent-lhr3-1.cdninstagram.com/v/t51.2885-15/e35/10844135_1152807924745217_1575566291_n.jpg?_nc_ht=scontent-lhr3-1.cdninstagram.com&_nc_cat=105&oh=6fcd31598b596827c424d177f725fed0&oe=5E7E082E,10844135_1152807924745217_1575566291_n.jpg,instagram.com/p/44WKUkIeUW,"Higganum West School House, Haddam","[41.4970432, -72.5570348]",41.49704,-72.55703
The sign for Quasset School in Woodstock (see previous post) is as cute as the schoolhouse itself.) #woodstock #woodstockct #ct #Connecticut #cthistory #newengland #newenglandhistory #oldschool #oldschoolhouse #oneroomschool #schoolhouse #oneroomschool #oneroomschoolhouse,7/5/15 22:59,https://scontent-lhr3-1.cdninstagram.com/v/t51.2885-15/e35/11386535_1464966453815400_286719698_n.jpg?_nc_ht=scontent-lhr3-1.cdninstagram.com&_nc_cat=100&oh=28dc6a712d3ecc2d39f4a96fab2f6037&oe=5E6E8319,11386535_1464966453815400_286719698_n.jpg,instagram.com/p/4xahS7oeVd,The sign for Quasset School in Woodstock (see previous post) is as cute as the schoolhouse itself,"[41.9251347, -71.9878344]",41.92513,-71.98783
"Quasset School, Woodstock. Built c. 1854. The first schoolhouse in this district was built in 1738, and the first public school in Woodstock was established in 1690. Random fact courtesy of the Town of Woodstock website: in 1963 ""the Lt. Ambassador of England representing Woodstock, England presented Quasset School with a portrait of King George II and a replica of the Union Jack that would have flown for the 27 years that the school was under British rule. Two oak trees from the grounds of Blenheim Palace in Woodstock, England, birthplace of Winston Churchill, were planted near the building."" #woodstock #woodstockct #ct #Connecticut #cthistory #newengland #newenglandhistory #oldschool #oldschoolhouse #oneroomschool #schoolhouse #oneroomschool #oneroomschoolhouse",7/5/15 22:57,https://scontent-lhr3-1.cdninstagram.com/v/t51.2885-15/e35/11379938_627617907374748_437931736_n.jpg?_nc_ht=scontent-lhr3-1.cdninstagram.com&_nc_cat=100&oh=8c865ad1c70bda3500eeaf246b313f81&oe=5E6F027D,11379938_627617907374748_437931736_n.jpg,instagram.com/p/4xaR4cIeU9,"Quasset School, Woodstock","[41.9251347, -71.9878344]",41.92513,-71.98783
